id,text,classification,type_of_antisemitism,image_url
1292620665854537728,"Macaroni can't even quell rioters N France, so what's he doing N Beirut? Doing what ever his banker bosses tell him 2 do, helping anudda' Zionist riot color revolution. Don't think Lebanese R that gullible, but money does talk. Just dont talk about Israel attacking Beirut.",1,0,https://pbs.twimg.com/media/EfBPo0CXgAAe387.jpg
1293093075384963078,"Don’t listen to them, a friend of mine that is from Israel she says to me that she hate her country cause she feels very disgusting when she see that her own government pay money to them to live there and kick Palestinians out. Not all israelies are Zionists and not all jews.",0,,https://pbs.twimg.com/media/EfH9HjcXgAIfcXm.jpg
1281434582815039488,&gt;'THEY_LIVE'&gt;Z.ombie-O.ccupied-G.lobe/ZOG&lt;,0,,https://pbs.twimg.com/media/EciRl5wWoAI3pIM.jpg
1291728521895780352,Aliens dropped me off here. 👽Minimal resistance on my end.,0,,https://pbs.twimg.com/media/Ee0kPXRXsAEDdu_.jpg
1293277451515244550,"Does it make you feel ""weird, or ""proud"", that they flew your SPQR flag in Charlottesville, Madison?    ""Jews will not replace us""--------Remember?? ",1,3,https://pbs.twimg.com/media/EfKk5nxXgAYh8eC.jpg
1276442013571956736,Day 5 Maths - Zog,0,,https://pbs.twimg.com/media/EbbVN1kX0AERf0y.jpg
1292025876499107840,"I was just thinking about this and thought of how laughable the antisemitism of MAGA dumbasses and some tradcaths is. Barr, Trump's most devoted bagman and an absolute Catholic fanatic, is ethnically Jewish. And they still think there's a ZOG plot do take down Trump or some shit.",0,,https://pbs.twimg.com/media/Ee4yo8OXkAYY-uA.png
1292864759285649412,And the Joker draws the line at Nazis too,0,,https://pbs.twimg.com/media/EfEtpA9XsAQfYvg.jpg
1293304221635211264,"Also, the Pew research you posted comes in at  85% Zionist at a minimum. If 85% of US Jews are either happy with US support for Israel or feel like it could do more, its not too far fetched to say 85% AT LEAST support Israel's existence, no?",0,,https://pbs.twimg.com/media/EfK89-nUYAAG_MW.png
1291760058062315521,Every single #@%!☆● day 🤬....88 to go...,0,,https://pbs.twimg.com/media/Ee1A7WxXkAAQyvc.jpg
1279128387609559042,We had to work out how many of Zog’s friends were left when some flew away.,0,,https://pbs.twimg.com/media/EcBge7HWsAAx0L1.jpg
1291834788907802626,Wait a minute... is that Zog from The Ultimate Adventure stageplay?,0,,https://pbs.twimg.com/media/Ee2E47oXYAE60Nr.jpg
1292589988975185920,Dropping the hyphen: Why a major Jewish publication is changing its spelling of antisemitism – J.,0,,https://pbs.twimg.com/media/EfAzvr3XkAIvG6D.jpg
1293208396821409792,"as the greatest president ever of America, the greatest country ever.  #MAGA #KAG",0,,https://pbs.twimg.com/media/EfJmLqIXgAExDoT.jpg
1292188090803552257,"3) (1920-30/40's) the creation of Irgun, Stern, and Haganah Zionist terrorist organizations that committed multiple acts of terror in Palestine, against the Palestinians and the British . Ex. The bombing of the King David Hotel in 1946. They disguised themselves as Arabs.",0,,https://pbs.twimg.com/media/Ee7GNtyWoAA6Oam.jpg
1293286540815163392,i highlighted thinks about jews daily bc i’m jewish and i think it’s funny,0,,https://pbs.twimg.com/media/EfKtQQ4UMAA7EE5.jpg
1293365546566782976,"The REAL loser here is corporations and the Israel Lobby, LMAOOOO!",0,,https://pbs.twimg.com/media/EfL1G_ZWkAECA_p.jpg
1293181508929421312,"Because the Golan heights was part of the British mandate - therefore Jews purchased lands over there, which were confiscated just to give this land to the French (which geographically doesn't make since to be in different country)",0,,https://pbs.twimg.com/media/EfJNunRUwAQPFBg.jpg
1280480578136166400,#JohnnyFlynn #Zog Zog (from interview),1,0,https://pbs.twimg.com/media/EcUuSDpWsAM_ogY.jpg
1290500446163857409,"Good news Luke, that song you hate is cancelled.",0,,https://pbs.twimg.com/media/EejHUNjU4AMA0pE.jpg
1276103047106748417,We have been reading Zog and making our own dragons today 🐉,0,,https://pbs.twimg.com/media/EbWg8_LWsAAdy3k.jpg
1292762839262756864,Good riddance to an anti Russia anti socialist &amp; anti Jew anti Arab (dig and see reality) far right racist flying under the radar disguised and all delivered on pretense of being an anti Zionist,0,,https://pbs.twimg.com/media/EfC_mo2UEAAPZsp.jpg
1289172966169706496,My hair still recovering from that zog in March 😂,0,,https://pbs.twimg.com/media/EeQP-kFX0AAEwBA.jpg
1291826526099582976,Very true.....hmmm 🤔,0,,https://pbs.twimg.com/media/Ee19YQuWoAQziH2.jpg
1293277010542895107,Ninny doesn't know about the steady presence of Jews there for 4000 years.   Ninny's ninny-go-round never gets new material.,0,,https://pbs.twimg.com/media/EfKkk-YXYAA3KDT.jpg
1293208908027310092,"Are women? because Emma is the one consistently making Nazi references. Certainly feminist rhetoric about men is similar to Nazi rhetoric about Jews though, how do you think a portion of Mein Kampf got published in a feminist journal during the grievance studies hoax?",0,,https://pbs.twimg.com/media/EfJmpNKXgAAlAJp.jpg
1292364840560926720,"So, let me get this right. &lt;Checks notes&gt; BlackJews who are Zionists and &lt;Checks notes&gt; speak up about antisemitism and &lt;Checks notes&gt; anti-Black racism and &lt;Checks notes&gt; toxic masculinity and misogyny are &lt;Checks notes&gt; not Black according to &lt;Checks notes&gt; not-Black people.🥨",0,,https://pbs.twimg.com/media/Ee9m5hbXYAIkyvh.jpg
1292215621728571394,Pls why I drag her thinking she was a Zionist but she wasn’t,1,3,https://pbs.twimg.com/media/Ee7fQeCXsAUvNAG.jpg
1293167886790516737,"If you are a senior or you are booking for a loved one, DON'T USE @AlfaTravel ruining everybody vacation &amp; put us all in danger. Shame on you for manipulating comments &amp; not using a genuine Facebook review system to fool people especially Seniors.",0,,https://pbs.twimg.com/media/EfJBSiVXsAAVj1W.png
1289161623022665728,Friday StoryTelling📖  Your Second Challenge today is to watch the Zog Story and tell us your favourite part &amp; why you liked it👍  Check out the North Ayrshire Youth Services Facebook page to find out how to enter👉,0,,https://pbs.twimg.com/media/EeQFqhGXoAEfv36.png
1293075666670419968,"You don't have to question Israel's right to exist to be hated, it is enough to objectively criticize their settlement policy to be insulted and despised as an anti-Semite, Nazi or Adolf Hitler. Such people spread hatred and prevent peaceful coexistence:👇",0,,https://pbs.twimg.com/media/EfHpH4IWAAAyZ10.jpg
1293125008110178305,The late South African anti-apartheid leader Ahmed Kathrada said Israel's apartheid rule over Palestinians is even worse than South Africa's apartheid regime.  Other racial and social justice leader have called for action to end Israeli apartheid:,0,,https://pbs.twimg.com/media/EfGzk-aXsAA0adp.jpg
1283061757234352129,Zog is the only robot character that’s worth a come back from the Astro boy movie. Even if he does remind me of those robots from Castle in the Sky.,0,,https://pbs.twimg.com/media/Ec5Z3XyX0AIkBjg.jpg
1293293716250255367,"""W-wait, Israel aided the Christian militias?  I don't know man, i don't want people to call me a zionist.  D-does this mean i have to like Israel"" Some people really buttblasted about that photo pfft. ",1,3,https://pbs.twimg.com/media/EfKzueTWoAUHHyV.jpg
1293090542738448385,are appearing on Veterans Today (placed by @Outbrain) next to an article claiming without evidence that Israel was behind the explosion in Beirut.  It's a moral outrage that this kind of content is being monetised. @Bloomberg must take action.,0,,https://pbs.twimg.com/media/EfEhjxgXgAEq3yC.jpg
1285288667754504192,"Welcome to the team!!   Meet our new recruits to the City Signs Team... Tumble, Gizmo and Zog.   They might be cute but they’re always eating on the job 😆  #Worcestershirehour #MalvernhillsHour #Worcestershire",0,,https://pbs.twimg.com/media/EdZDOySXsAECkC2.jpg
1282329701789380613,ZOG!,0,,https://pbs.twimg.com/media/EcvAD-JWoAUYpnW.jpg
1293088240434655232,How can the United States and the Zionist regime take advantage of the explosion in the port of Beirut? 1-To Punish the Lebanese government A mastered destructive action that completes all attempts to punish the Lebanese environment and government that reject USA #haqiqamedia,1,0,https://pbs.twimg.com/media/EfH43csXsAEf2O8.jpg
1280407032621862912,When da new grot started yellin' WAAAGH!! at 3am I was dead excited and fort we woz gonna go and do some krumping! Den dis happens instead...WOT DA ZOG!? Can't 'andle her squig juice...,0,,https://pbs.twimg.com/media/EcTrZovWsAg7Khu.jpg
1285269607222321153,"And, just like that..carbon dioxide became a good thing..",0,,https://pbs.twimg.com/media/EdYs1hKWoAM0uuJ.jpg
1291793944787943425,i do not care for yandev deepfake memes,0,,https://pbs.twimg.com/media/Ee1fvXbWkAYXqAN.jpg
1292654024328503296,Who has feverishly capitalized on the 911 attacks? John Bolton and his fellow #Zionists. @netanyahu #PNAC,1,0,https://pbs.twimg.com/media/EfBtDxAVAAAutgo.png
1275975749070204928,Your welcome,0,,https://pbs.twimg.com/media/EbUtLigWsAIF-5x.png
1293155440944123905,"11 August 1942 | A transport of 559 Jews deported from #Westerbork in the German-occupied Netherlands arrived at #Auschwitz. After the selection 164 men &amp; 131 women were registered.   The remaining 264 people were killed in a gas chamber, incl. a 2-year old Magdalena Dora Blau.",0,,https://pbs.twimg.com/media/EfI1-vbWkAEY_6S.jpg
1293208582620577793,"And not only the Palestinians, everyone who stood in the Zio Israel way....",1,0,https://pbs.twimg.com/media/EfJmWXcWAAEGc5A.jpg
1276573862134677504,Nice.,0,,https://pbs.twimg.com/media/EbdNKBbXYAEesWh.jpg
1289359768117600256,D2 Promo game be like.  I know stormavatar is a good player but still,0,,https://pbs.twimg.com/media/EeS5xq9XYAITMi6.png
1293321493644967940,12 August 1922 | Polish Jew Szlama Huberman was born in Radom. A worker.  In #Auschwitz from 1 October 1941. No. 21184 He perished in the camp on 6 November 1941.,0,,https://pbs.twimg.com/media/EfLNC4YXgAEaSsh.jpg
1286338282834530306,"If you’re looking for a story that encourages good values, persistence, and breaking the mold of who everyone says you should be, then ZOG is just what the dragon ordered! Check out this lovable tale &amp; an activity inspired by the film on the #JBFCedu blog:",0,,https://pbs.twimg.com/media/EdI_WxbWoAY8qNV.jpg
1293301476975169537,"Here is something I did not think I would ever say... Israel has a professional ice hockey player... and he plays for Auschwitz (Oswiecim).  Yes, you heard that right....  #IceHockey  #Holocaust",1,3,https://pbs.twimg.com/media/EfK6gyNXYAETuNL.jpg
1292215803346145281,Can y'all just take a minute to appreciate my mum's eBay listing for the film 'Zog' aka 300 😂😂😂 I cried real tears LMAO  #closebutnotquite #ebayfail #innocentmistake  #Zog,0,,https://pbs.twimg.com/media/Ee7fbJaWsAEk3Je.jpg
1293200429371789312,suspension lasts but here is a success against a #Jewhater! #NoSafeSpaceForJewHate,0,,https://pbs.twimg.com/media/EfJe7thXYAA6GJD.jpg
1293283371569864707,I have a suspicion that Mark Twain was a Jew like if you agree.,0,,https://pbs.twimg.com/media/EfKqU_GXYAAn3ng.jpg
1291469023020974080,And I'm like..🤣,0,,https://pbs.twimg.com/media/Eew4NgTWkBAPxKY.jpg
1292632415597465606,So that WAS you 😆😅😂🤣!!,0,,https://pbs.twimg.com/media/EfBaVPjXkAE-JoL.jpg
1293303291342811138,I have a crush on my fucking Jew  UUUUHH I MEAN NOT WRONG??,1,3,https://pbs.twimg.com/media/EfK8fUCU0AAz4R-.jpg
1287788534062034944,They're still pretending that they're rebels for supporting ZOG and the entire anti-white establishment in promoting this hoax.,1,0,https://pbs.twimg.com/media/Ed8kwlBWAAEyUUu.png
1292491042013552640,"With all ur power, the conspiracy of the Zionists movement, this is all what u could put ur hands on from the land of Palestinian. The Haganah criminals finished the job.",1,0,https://pbs.twimg.com/media/Ee_Zv20XYAACJXB.jpg
1277561586962628608,Cassidy has written a few sentences about zog and done a mini phonics assessment for me,0,,https://pbs.twimg.com/media/EbrPfVgWsAA0ffW.jpg
1293183380834508800,"If we base every territorial disputes on historical perspective, we will go nowhere.  Jews claim that Abraham is the “HEIR OF THE WORLD” called LAND PROMISES. That is why Israel went to war with bordering nations. China claim of SCS is based on historical records of 2 dynasties.",0,,https://pbs.twimg.com/media/EfJPSvXU4AY383W.jpg
1293346359370752001,"The great Yiddish writer Isaac Bashevis Singer once described some interfaith conversations as ""My God, Your God"" discussions, as if we own God and speak for Him.   Better we should meet and share our  deep personal connection with God than some misplaced sense of ""ownership."" ",0,,https://pbs.twimg.com/media/EfLiU85XkAElF4n.jpg
1278026097133789191,We have been learning about the story of Zog. Today we made a story trail showing the events that happened in the story.,0,,https://pbs.twimg.com/media/Ebx14E1WoAcWWTI.jpg
1275862967184175104,Thanks for adding your,0,,https://pbs.twimg.com/media/EbTGmREXkAc1F_V.jpg
1293274095031848963,And now I will back those claims up. ‘Jewish facial features’? You mean hooked noses? You think that’s a ‘Jewish’ feature? Nice. Der Stürmer thought the same thing. There are all kinds of Jews. BAME Jews. Caucasian Jews. We’re all different. But you? Think we’re all the same.,1,3,https://pbs.twimg.com/media/EfKh7zYWoAIf9rd.jpg
1293302077574098944,"Listen here, media person. I am a convicted “anti-Semite” with an 8000 EURO fine and a 6 month prison term on my record for “talking about” Jews.",1,3,https://pbs.twimg.com/media/EfK7Yr8UMAENst9.jpg
1293198163965140992,"CSHE analysis shows spike after POTUS ""very fine people"" presser to over 25 hate crimes per day and in particular against Blacks and Jews in the 6 days following.  Aug. 2017= 3rd worst month of decade (tie) ",1,0,https://pbs.twimg.com/media/EfJcXsPUcAYHVe4.jpg
1293310987584462848,JESUS CHRIST IS A CHRISTIAN SPIRIT  JESUS CHRIST NEVER SAID THAT HE IS A MUSLIM  JESUS CHRIST WROTE HIS BIBLE SO THAT U COULD KNOW HIM  JESUS CHRIST IS THE MESSIAH THAT U ARE WAITING FOR A VERY LONG TIME  JESUS CHRIST SAID: IM THE GOD OF THE JEWS!  - Mark 15.2,0,,https://pbs.twimg.com/media/EfLDfNyU4AA0BMk.jpg
1293208228013187073,16 Kaddish Facts Every Jew Should Know,0,,https://pbs.twimg.com/media/EfJmBV4XsAIKXps.jpg
1281114353576656896,"and #Zog. 🌟   Did you know, the short animated film is currently available to watch on @BBCiPlayer? Perfect for a soggy afternoon - grab a blanket and enjoy!",0,,https://pbs.twimg.com/media/EcdutfAWsAExKGb.jpg
1290739732301983745,Naturally #DoctorWho,0,,https://pbs.twimg.com/media/Eemg8cpWsAIdd6E.jpg
1292238314767097857,literally jus went ona whole anti zionist cyberbullying rampage,1,3,https://pbs.twimg.com/media/Ee7z5MtXoAAeU0N.jpg
1275819329032880131,Don't bother hes calling Litecoin useless yet the guys buying all Low Cap Worthless Shit Coins tryin to get Rich. Clearly he listens to others rather than study an do his own research.😂😂😂,0,,https://pbs.twimg.com/media/EbSe6piVcAAbuKS.jpg
1293291468996698112,Spidey senses were tingling... #dojogang safe 🥋🔥🥋,0,,https://pbs.twimg.com/media/EfKxuPeWkAQdprX.jpg
1292863726983491584,.More proof that you are an Anonymous FAKE rabbi.  All rabbis/Jews are Zionists except for .07% who are Neturei Karta &amp; friends.  This guy will tell you. @RabbiJWeinberg,1,0,https://pbs.twimg.com/media/EfEssADXYAEJVY3.jpg
1292644007139512320,". Zionists weren't gifted sht  They lived in or entered Palrstine legally, &amp;bought what they had for cash, &amp;built &amp;defended everything  In fact they paid 10X the value of the land so Israel must be 10X bigger",0,,https://pbs.twimg.com/media/EfBk34qWkAMpabJ.jpg
1292994577075494918,"""We're not antisemitic, we're only anti-Zionist."" ",1,0,https://pbs.twimg.com/media/EfGjtriWoAk5RZB.jpg
1280846257389555714,I couldn’t help looking at this and thinking Jean Dujardin would be a natural for the role of King Zog ...,0,,https://pbs.twimg.com/media/EcZ64JYXQAUd-_W.jpg
1292211882066153472,"My recent bylines are giving off some real ""Hip Rabbi Who Dabbles in Digital Media"" energy ",1,2,https://pbs.twimg.com/media/Ee7bglXWkAQp1cI.jpg
1292493936741830656,"Please nobody tell him that Neomi Shemer was a right-wing, pro-settlement Zionist, or that the song was accused of being racist, by describing the streets of the Old City of Jerusalem as ""empty"".  It didn't ""become"" anything. It was written as such. ",1,0,https://pbs.twimg.com/media/Ee_bmBCWkAADTrw.jpg
1292723475367571457,"This is what i think of #Jew and #Israel, #Zionist haters.",0,,https://pbs.twimg.com/media/EfCtHG2WkAUK-qP.jpg
1288006140765171717,ready to rent you a boogie board while wearing a tie dyed mr zog’s  sex wax t shirt and flip flops.,0,,https://pbs.twimg.com/media/Ed_qv7WUMAAmm_Z.jpg
1278672421143314434,@GOldfleet,0,,https://pbs.twimg.com/media/Eb7Br-RU8AAO0uQ.jpg
1292199199526846464,why do zionists even try.....,1,3,https://pbs.twimg.com/media/Ee7QUsBXYAE4Ef2.jpg
1293370050930520066,If it were possible six million dead Jews along with the other 70+million people who died during WW2 would like a word with you,1,3,https://pbs.twimg.com/media/EfL5NPZWoAAjd4-.jpg
1293041066942365696,"Watching this Child's heart break as she watches Zionists demolish their home, I wish I could believe in a god, a #Zionist god of RETRIBUTION who'd tear down EVERY INTRUDERS place  I try not to be a hypocrite so must rely on other than a god for a fix 'Peace comes dropping slow'",1,0,https://pbs.twimg.com/media/EfHN_09XgAAdjGL.jpg
1292408204157161472,"Why is it, when I ask about the borders of historical Palestine, as represented by the League of Nations’ British Mandate Palestine, none of my anti-Zionist buddies respond? Let’s say Jews stole Palestine. What % of Palestine did they steal? All of it? 26%? Do y’all know?",0,,https://pbs.twimg.com/media/Ee-OaKYX0AIfpBJ.jpg
1293161748392968192,"""Apartheid?"" The third largest party in the Knesset is the Palestinian Joint List Party. How many Jews and other minorities are represented in the PA, Hamas, and in governments of nations surrounding Israel? ",0,,https://pbs.twimg.com/media/EfI7wOUXoAE2v7s.jpg
1292379131162898433,Here's #DanielLismore with Rabbi Shmuly pal #PamelaAnderson - Lismore pals with cocaine addict #BoyGeorge who has a conviction for false imprisonment George was helped by cocaine user/ Royal fave #RichardBranson listed in #Epstein's black book #NaomiCampbell #Maxwell #Guiffre,0,,https://pbs.twimg.com/media/Ee9yfYLXYAEa063.jpg
1293314313390895110,"Exactly it’s says it right in rev 1:14-15, Even Russia knew this, (which were also ran by blacks). Everytime jews tried to argue that they are god’s chosen I just hit them with Rev 2:9 and keep it moving💯",1,2,https://pbs.twimg.com/media/EfLGgzmWkAAR539.jpg
1280866044672950272,Amy really enjoyed doing her Rainbow ZOG Castle,0,,https://pbs.twimg.com/media/EcaM2xgXYAEP5w6.jpg
1293066164118183937,delete this tweet? [Rhetorical],0,,https://pbs.twimg.com/media/EfDaw70WsAA_koV.jpg
1278340551100772353,Book Review... Amelia’s review on Zog 🐲,0,,https://pbs.twimg.com/media/Eb2T8_qWkAcem8y.jpg
1292478753352724480,"The Zionist imperialistic propaganda machine is working at full force, attempting to capitalise on the recent #Beirut explosion. Trying to divide &amp; conquer the people of #Lebanon, and cripple Hezbollah. The Axis of Resistance will endure any hardship it faces. ✊🏽  #DeathToZionism",1,0,https://pbs.twimg.com/media/Ee_Ok1TU4AIMH_M.jpg
1280478424512020485,"No as in Zog the children's book character, making her a costume of a character from my childhood would be downright esoteric",0,,https://pbs.twimg.com/media/EcUsVQcXYAA4pcc.jpg
1292548399959605250,Zionist play the victims of their own crimes,1,3,https://pbs.twimg.com/media/EfAN0uqXsAI3A3_.jpg
1281651554617966592,,0,,https://pbs.twimg.com/media/EclUvQ6XkAENEix.jpg
1293248408967356416,Even the antisemitic conspiracy theorist Ryan Dawson has rejected the theory that Israel was behind the Beirut explosion. And this is literally a man who built his entire career off of claiming that Israel did 9/11 mind you.,0,,https://pbs.twimg.com/media/EfKKctsXgAcHq-Z.png
1293093314330275842,"A few days earlier, a similar ad for the same hotel appeared in Haaretz (aligned with the centrist General Zionists; a few years later it was bought by the Schocken family)",0,,https://pbs.twimg.com/media/EfH9CHIWkAE_JZo.jpg
1293276498217046019,there are really good jews and i love them like i love myself and then there are the pretenders who hide behind the wonderful amazing jews and they are the ones (zionist) who occupy palestine and want to run the world. zionist puppet masters have their main base in city of london,1,0,https://pbs.twimg.com/media/EfKkAZdXoAE9EGh.jpg
1293056175961972736,Hating interracial dating so much that I actually just morph into a reactionary Zionist,1,0,https://pbs.twimg.com/media/EfHbvJzWoAALhjc.jpg
1277995252121559053,Ellie has coloured in her dragon mask from the book Zog,0,,https://pbs.twimg.com/media/EbxZ5z6X0AIPs_b.jpg
1293253097272246272,"Exactly three years ago today the #Charlottesville riots, which lasted 48 hours and shook the American landscape, began. Trump-empowered #Nazis marched in this Virginia university town to protest the removal of #ConfederateStatues. “The #Jews will not replace us,” they exclaimed",1,3,https://pbs.twimg.com/media/EfKKBCOXkAE1Pld.jpg
1290503620358598657,And to think we could have had him,0,,https://pbs.twimg.com/media/EejKM6DU8AEPU2H.jpg
1293174069249048576,"for their wonderful feature story about @HamptonShulTHS' Jewish Film Festival which takes place Sunday evenings at 8:30pm at Francis S. Gabreski Airport. This Sunday, we will screen ""Aulcie Perry.""  ",0,,https://pbs.twimg.com/media/EfJG9NwWkAE8PTw.png
1281339298298703874,“Director of hasbara” he’s a Talpion working hand-in-globe with the evillest apparatuses of the US ZOG.,1,0,https://pbs.twimg.com/media/Ecg7TEBXoAAP872.jpg
1291368449759830018,There’s a chinchilla shop (farm?) near my workplace and- look at those chonky bois 🥺  How I wish I could live like a chinchilla 🥺,0,,https://pbs.twimg.com/media/EevcvsHUcAAVyg_.jpg
1292203551574425601,I’m really sitting here and laughing while bullying a zionist. I got the time and patience today.,1,3,https://pbs.twimg.com/media/Ee7UR9vX0AMRaAs.jpg
1291102392734408705,Sadly cash app doesnt work in Denmark :(,0,,https://pbs.twimg.com/media/EerqyBOXoAE1bsG.jpg
1278084720740401152,"One of the milder forums, the usual subject. At least they don't say 'ZOG'.",0,,https://pbs.twimg.com/media/EbyrKqLXgAYoEp1.jpg
1283533343401926656,My Neighbor ZOG #鉄腕アトム #Ghibli,0,,https://pbs.twimg.com/media/EdAGxIIWAAMKUHp.jpg
1293213203359346688,Hate America? Vote .@TheDemocrats  Hate Jews? Vote .@TheDemocrats  I didn't leave .@TheDemocrats they left me  cc: .@ewarren,0,,https://pbs.twimg.com/media/EfJqeKXU4AYKhjc.jpg
1279627838442930177,Have you visited Sherwood Pines yet? We have been following the Zog Trail (formerly The Gruffalo Trail!) deep in the heart of Sherwood Forest!,0,,https://pbs.twimg.com/media/EcImvM7WoAcnM3O.jpg
1293251118806573056,"lmao, russia has always, even before the bolsheviks, had problems with jews. The bolsheviks tried to stop antisemitism while the anti bolshevik military we supported used this kind of propaganda to portray bolsheviks. Hell, there was the whole ""judeo-bolshevik"" conspiracy theory ",1,0,https://pbs.twimg.com/media/EfKM03hWoAEFLC5.jpg
1293244822652956673,"""During WW2, two Polish doctors saved 8,000 Jews from the Holocaust by faking a typhus epidemic. German armed forces, afraid of spreading the disease, chose not to enter their town.""  And this just gets better! Y'all know this though!!  Think about what President Trump is saying! ",0,,https://pbs.twimg.com/media/EfKHHzLXgAE_bNO.jpg
1293279804758937600,"All through German-ruled Europe, Jews were a special target. In what became a policy known as “The Final Solution to the Jewish Question,” the Germans aimed not only to kill every last Jew, but also to remove all evidence of the Jewish people’s contribution to human civilization.",0,,https://pbs.twimg.com/media/EfKnIG9WoAYaALr.jpg
1292924514100301824,"How long will we continue to allow these”imposters”warp this false statement on THMLF? Well,since lying has become t/Amerikkkan n Zionist way!Why was Hitler so admired by this country,in fact,notice a slogan that he used that is now t/fascist battle cry used today?”Man of t/year”",1,3,https://pbs.twimg.com/media/EfFj_gDWoAImSbv.jpg
1277615249605234688,,0,,https://pbs.twimg.com/media/EbsARjsXsAAH-lh.jpg
1293342449562202112,socialist uprising? Communists and Jews were being lynched in the Hungarian Uprising which was flooded with the Arrow Cross party members reminiscent of the white terror in 1919.,0,,https://pbs.twimg.com/media/EfLgFnLWkAA1vpB.jpg
1293090066374500352,"On a podcast interview with Marc Maron, Seth Rogen said that ""as a Jewish person he was fed a huge amount of lies about Israel” and questioned why the state should exist. "" #Israel #sethrogen #antiZionism ",1,3,https://pbs.twimg.com/media/EfH3qnAXYAEeknG.jpg
1280034285655752705,Last page of Zog... is this a unicorn 🦄 or a goat 🐐,0,,https://pbs.twimg.com/media/EcOYY7oUEAAiVWM.jpg
1278270746658328580,cassidy’s book review of zog- fair to say she likes the story 😍,0,,https://pbs.twimg.com/media/Eb1Ud4AXkAEDsw8.jpg
1290369948611760134,📚 🎨 🐉 A story book and arts workshop themed by the book #Zog by Julia Donaldson.,0,,https://pbs.twimg.com/media/EehQnghXkAQqb_x.jpg
