id,text,classification,type_of_antisemitism,image_url
1275780134105202688,"Pictured here is Zainab Soleimani (left), the daughter of IRGC Major General Martyr Qasem Soleimani, and Soheila Zakzaky (right), the daughter of Nigerian Sheikh Ibrahim Zakzaky who is currently illegally imprisoned in a Nigerian ZOG cell.",0,,https://pbs.twimg.com/media/EbR7QbSUYAEfBJp.jpg
1292224074329055233,There once was an actual President...those were rhe days....siìiigh,0,,https://pbs.twimg.com/media/Ee7m8oSWAAI2Vjf.jpg
1293023343306838017,okay like if u see this shit on ur tl or anywhere pls understand its such bullshit .... these ppl are just pushing a zionist narrative where the ppl are begging to be colonized and an international investigation would literally allow western influences to cover up anything+,1,0,https://pbs.twimg.com/media/EfG937WXYAAD0Hz.jpg
1293202186495766529,Jordan Uhl: look at this weird little jew recite WAP  Also Jordan Uhl:,0,,https://pbs.twimg.com/media/EfJgiPDWsAAIeYJ.jpg
1293273507900665857,"A Swastika was painted on the exterior wall of Kesher Israel Synagogue in Harrisburg, PA.  Acts like this seek to do more than spread hate, they aim to intimidate &amp; frighten the Jewish people, but we won’t bow our heads to fear.  Instead, we will seek justice.",0,,https://pbs.twimg.com/media/EfKhZgfWoAUr1Og.jpg
1275725922344321027,👋🏼Jude wrote a book report about Zog yesterday! He awarded it 5⭐️s 😊,0,,https://pbs.twimg.com/media/EbRJ8nrXgAEbuDt.jpg
1284241463971209216,"why yes, that is me.. ლ(⁰⊖⁰ლ",0,,https://pbs.twimg.com/media/EdKKzf2VcAA5UeU.jpg
1293289855661809664,"My grandfather befriended a man who told him the British needed an engineer in Tanganyika. . . . He became the only fix-it person — and one of a handful of Jews — in a Polish refugee camp in Africa. — from “Work” (Readers Write), Heidi Harrison",0,,https://pbs.twimg.com/media/EfKwRNDXgAAHKDP.jpg
1293325336629972992,"The Arab leaders were so certain of their victory against the overmatched, underdog Jews they encouraged the people to leave, promising them they would soon be able to return. But they got an early taste of Israel’s spirit. 2/",1,3,https://pbs.twimg.com/media/EfLQf94XYAAwj9J.jpg
1292897382900928517,back in june there was a huge gap between the number of deaths in pa controlled areas &amp; those directly under zionist occupation,1,0,https://pbs.twimg.com/media/EfFLT9UXsAImRpl.png
1293061561226014720,"🎥Photos|| Members of Arab, Black, Indigenous and #filipino struggles for justice filled streets of #Dearborn in solidarity against Zionist land theft and global fight against racism, #Colonialism and military industrial complex. Watch 👇👇 #PrayForPalestine🇵🇸 #Palestinians",1,0,https://pbs.twimg.com/media/EfHgombXoAA1f4x.jpg
1275804849637068801,Today's task is to write your own set of rules for Zog. 🗒🗒 Remember to use your 'pinchy fingers' ✍,0,,https://pbs.twimg.com/media/EbSRvoVXgAAzGRE.jpg
1293169483306147841,"It is #Verwoerdian 🤣  Jimmy, replace 'Jew' with 'White',  and 'English and Afrikaans speakers' with 'Black People' and tell me where the difference lies?  🤔",1,3,https://pbs.twimg.com/media/EfJCsrOXYAcIrNb.jpg
1292424653806407680,"Antisemitic people have Bella hadid, Zionists have Harry styles. It’s not about winners or losers but we won.",0,,https://pbs.twimg.com/media/Ee-dXRyWkAEjRWM.jpg
1293299194950754309,"Neo-#Nazi #OklahomaCity #terrorist bomb: 168 deaths, 800 injuries. Nazi terror continued to target lives of #Christians, #Jews, others in #USA &amp; world, including 2014 murders in KC, 2009 murder at USHMM, Maine dirty bomb plot, plot to kill 2000 in Spokane",0,,https://pbs.twimg.com/media/EfK3CrIXoAIjm-_.jpg
1293114552951939072,"The first chapters of the Bible, of the creation of the earth and the universe, down to humanity, they are reworking of the Sumerian writings of thousands of years before the birth of the Jews people. Therefore, the Bible is not the word of God, but of a mythology of the Sumerian",0,,https://pbs.twimg.com/media/EfIQ1OSX0AANE9m.jpg
1284430484341231616,Iblis.....or his minions like Al Uzza etc...🤔,1,2,https://pbs.twimg.com/media/EdM2tJGWoAMjZ5G.jpg
1292310323991437312,"Motive is the key! Beneficiaries of the change in power to facilitate &amp; secure the slave master, warmonger, women &amp; baby killer, terrorist, racist apartheid zionist exploitation of the native´s resources via installing puppet oppressive dictator tyrans by intimidation &amp; coercion!",1,3,https://pbs.twimg.com/media/Ee81Y-0UwAIYdQ3.jpg
1293307894926962691,"He blocked me, so I can't respond to his reply directly.  It was not my intention to imply that he was an anti-Semite (I read his profile, I knew he was a Jew), though I wasn't exactly clear in my very blunt responses earlier, so I fault myself for that.",1,3,https://pbs.twimg.com/media/EfLAK46UEAE2Ceq.png
1293176348907843584,‘Christ’ means Messiah. We Muslims don’t deny he is The Messiah. It is the Jews who deny that.,1,2,https://pbs.twimg.com/media/EfJJB79XYAAPxG7.jpg
1293234882768801792,Idk who else needs this but Goodmorning Israel 🤎,0,,https://pbs.twimg.com/media/EfJ-RQQUcAUmqKU.jpg
1282709381709258755,,0,,https://pbs.twimg.com/media/Ec0ZYLkXgAET0gI.jpg
1293286277735780352,"You’re so full of lying 💩, you should be flushed asap. Turks, and Turks alone, were responsible for the Armenian genocide. History. Russian Bolshevism was theoretically an egalitarian movement that SOME Jews, from their experiences of pogroms &amp; ghettoes, welcomed. History.",0,,https://pbs.twimg.com/media/EfKtA1dU8AAayJG.jpg
1293247530092785664,"You know that free POC Slave owners outnumbered Jewish ones by 15:1 right?  It was wrong.  And very few Jews were involved.  Many were hoping that assimilating into South as ""good citizens"" would help them be safe and not seen as ""other."" And many did assimilate. ",0,,https://pbs.twimg.com/media/EfKJi1zU0AATBUy.png
1292489805222166528,,1,0,https://pbs.twimg.com/media/Ee_YnlkVAAEkopw.jpg
1292437473520488448,"Torah MiTzion mourns the loss of Ha'Rav Adin Steinsaltz ZT'L. He had a tremendous influence on Torah MiTzion - both being a teacher and role model for many of our rabbanim and shlichim and more generally, as a leading sage in our generation.",0,,https://pbs.twimg.com/media/Ee-odZlXkAAjhmv.jpg
1275780371699978240,,0,,https://pbs.twimg.com/media/EbR7et9WoAI3teL.jpg
1293262503607177218,"The ish of a Jew worships Hasatan; they use media &amp; music to push his agenda in order to keep you in sin. Proverbs 23:27 For a whore is a deep ditch; and a strange woman is a narrow pit. 28 She also lieth in wait as for a prey, and increaseth the transgressors among men. #NASTY",1,2,https://pbs.twimg.com/media/EfKV88JWkAEtd65.jpg
1276148638679523333,We have been doing some fantastic learning around the story of Zog. We have made 2D shape pictures of castles and dragons and made some shields too. Don't they look fantastic!,0,,https://pbs.twimg.com/media/EbXKZGMWsAEKS9M.jpg
1277618339901083648,Christopher Langan is notable for having the highest recorded IQ score in the world (200).  He was banned from Facebook after he made this post:,0,,https://pbs.twimg.com/media/EbsDGwCU0AAXFR8.jpg
1292340739809128450,Wait he a zionist?,1,3,https://pbs.twimg.com/media/Ee9RDZOXYAImzVQ.jpg
1276442522533998593,@coi_papa's account is temporarily unavailable because it violates the Twitter Media Policy. Learn more.,0,,https://pbs.twimg.com/media/EbbVrnFXkAE-ZuQ.jpg
1292851395750760455,The corruption is from the ones who were in power for so long. And there wouldn’t be anything called hezbollah if the Lebanese government was able to defend the south from the Zionist occupation. Hezb was created as a REACTION to defend and protect all Lebanese,0,,https://pbs.twimg.com/media/EfEhfafWsAAb8-x.jpg
1278301278746091522,We have been creative and have decided to change three things in the story of Zog. Here are our ideas.,0,,https://pbs.twimg.com/media/Eb1wO9TWAAUdp8V.jpg
1280568232701841408,Were are sane people🤭🤭,0,,https://pbs.twimg.com/media/EcV-AltWAAMlWYL.jpg
1283487688490913792,Candace so much respect for you - you are being very naive however You need to research the ZOG,0,,https://pbs.twimg.com/media/Ec_ctl3WsAMdyPH.jpg
1292732245598523392,"Jews in the Polish Army  “In 1936, I became the Chief Rabbi of the Polish Army. I took care of ✡️soldiers, explained to them why they should be loyal to Poland...” Baruch Steinberg. On 12.04.1940 the Soviet NKVD executed him, along with a group of 🇵🇱 officers in the Katyn Forest.",0,,https://pbs.twimg.com/media/EfC0mtCWoAAY9XJ.jpg
1292745162217664513,"Good experience working on the badges, and severely under valued fees.   Chocomilkies for all!",0,,https://pbs.twimg.com/media/EfDA358XgAEob0D.jpg
1278757373490987010,This cloud looks like Zog from them children’s books by Julia Donaldson.  Now that you’ve been shown etc   #shapesinclouds #cloudspotting #zog #dragons,0,,https://pbs.twimg.com/media/Eb8PDGmWAAAA6Uq.jpg
1292261065267404800,"He stays on the golf course and you stay beholden to a foreign agent. In fact, you are a proud Zionist. You let everyone know where you stand. Unfortunately, it is not with the working class, the masses of US taxpayers.",1,0,https://pbs.twimg.com/media/Ee8IBc_UEAMQEFs.jpg
1292227608281849858,"Try hours before...already happening LIES, LIES, LIES...oop I meant @GOP ..¯\_(ツ)_/¯ Same thing....",0,,https://pbs.twimg.com/media/Ee7qKXXWAAA8VNy.jpg
1279081935235698688,"All Americans have the same rights. You should read the bill of rights, my friend.",0,,https://pbs.twimg.com/media/EcA2OuwWsAAcpKk.jpg
1293226356873011200,#DefineItToFightIt Yesterday on Facebook's 'Truthers against Zionist Lobbies'.,1,0,https://pbs.twimg.com/media/EfJ2aL3XsAEkxeW.jpg
1291067557127086080,A hint:,0,,https://pbs.twimg.com/media/EerLGe-XsAAGEME.jpg
1292104350739963904,Then people seen this other Rabbi laughing about Holocaust on his own race ? I think William Cooper who predicted 9/11 before it happened in his book Behold a Pale  Horse knew.,1,3,https://pbs.twimg.com/media/Ee55pbGX0AAOgez.png
1292815816489041920,"#USA  As long as there are Saudi oil dollars, the looting thoughts of the American rulers are world-eating. As long as the Zionist regime's cancer is in this region, we should watch.",1,0,https://pbs.twimg.com/media/EfEBIf2XYAEzhh5.jpg
1293204176927948804,"Remember this face.  These are the same people that claimed to just be ""following orders""  when they rounded up Jews and sent them off to Concentration Camps ~90 years ago in Nazi Germany. ",0,,https://pbs.twimg.com/media/EfJiEk8XgAAJww8.jpg
1283481014292172800,Piercing the sun during the #NorthropGrumman launch of its Minotaur IV rocket from the Mid-Atlantic Regional Spaceport launch pad 0B for the clandestine  #NROL129 mission.  Image Credit: A. Mankevich / ZOG-43,0,,https://pbs.twimg.com/media/Ec_WdxQX0Ag9SLN.jpg
1.29321E+18,Facebook needs to adopt the IHRA definition of hatred against Jews to clean up he mess on their platform. #DefineItToFightIt,0,,https://pbs.twimg.com/media/EfJoVA1WAAQw8m7.jpg
1293334377938722816,Doesn't matter how many times you repeat BS. It's still BS.  Can't rewrite history little girl. Jesus is a Jew through and through.,1,2,https://pbs.twimg.com/media/EfLYwy9XkAYmG0Q.jpg
1292223210994446338,Doubtful Mount Rushmore can support this @realDonaldTrump,1,3,https://pbs.twimg.com/media/Ee7mKYBXsAMjxw-.jpg
1293170803987697664,"On a podcast interview with Marc Maron, Seth Rogen said that ""as a Jewish person he was fed a huge amount of lies about Israel” and questioned why the state should exist. "" #Israel #sethrogen #antiZionism #Hollywood ",1,3,https://pbs.twimg.com/media/EfH7GkYWkAAIaPx.jpg
1292205627742334979,giving America away for this puppet ? You're beyond dead....we're gonna need a new party... Whatever 2016 hack has *will* eventually come out....,0,,https://pbs.twimg.com/media/Ee7WK60XkAALawA.jpg
1292610875967365120,Rabbi Yitzhak is STILL Israel’s TOP rabbi. And let’s take a look at how he depicted Black people.,1,3,https://pbs.twimg.com/media/EfBGvZiXoAEuLTt.jpg
1293165282824015874,FBI Sweeney said VICTIMS #PTSD Ghislaine Maxwell! FBI Ignore ptsd VICTIMS NYPD IA OUR #CIVILRights violated!email to Det Vergona + Ray Kelly office False arrest babbling Jew Sabbath?PTSD babble?My 1stJudge Alison Nathan.Jeffrey Epstein DrFDH mocked me too!,0,,https://pbs.twimg.com/media/EfI-9-6XgAAxE8s.jpg
1286464643171483650,Wez just as smart as wyte ppl sheittttttt,1,3,https://pbs.twimg.com/media/EdpwxYcXkAUa_Lq.jpg
1275797320135827456,bought us a brand new one! What a lovely surprise! Your kindness has made our day. Thank you! 💛☺️💙,0,,https://pbs.twimg.com/media/EbSK5XKX0AAUf3L.jpg
1293152654198214657,"Peter charged the Jews with using lawless men, the Romans, to put Jesus to death even though it was part of God's plan.",1,2,https://pbs.twimg.com/media/EfIze4zWoAA2yPg.jpg
1293275939221262336,And Israel still want us to shed tears about the Holocaust? What is the difference between what they are doing to the Palestinian Children &amp; what Hitler did to them? What a shame! The Jewish hypocrisy must be condemned as vigorously as we condemn Hitler.,1,3,https://pbs.twimg.com/media/EfKjnAwXYAAg7ob.jpg
1279886151848005632,More of our Zog stories . . .,0,,https://pbs.twimg.com/media/EcMRqKBXsAQXqUe.jpg
1281552767694319616,Today’s challenge from Zog- in year 3 the dragons learned to blow! Look at our fiery dragons⭐️⭐️🔥🐉,0,,https://pbs.twimg.com/media/Ecj9bpSXkAAtDWS.jpg
1293128679963361280,"1) The far majority of Arabs that came into Israel did so in the early 1900s as migrants. 2) In 1948, many returned 'home' to allow 6 Arab armies to massacre the Jews. 3) Those that remained, became 'Palestinian' as a tool to rid the area of Jews.",0,,https://pbs.twimg.com/media/EfIdM3MXYAIsvm0.jpg
1293296693258129419,"Me: ""Emily, give me your phone"" Emily: ""no! You're gonna post about Hitler or the Jews or something"" Me: ",1,3,https://pbs.twimg.com/media/EfK2fRCWAAEAXE8.jpg
1281507736082161665,we have been practising writing some of the words from Zog,0,,https://pbs.twimg.com/media/EcjUfesXoAEzAb6.jpg
1293179193014935553,"picked a fight with the old ornery Jew and then like the pussy he is, blocked me because he wasn't winning the argument he started and his little feelings got hurt. @StephenBannon I will still listen to #WarRoomPandemic even with the pussy.",1,3,https://pbs.twimg.com/media/EfJK72zUEAIs5bf.png
1292805241847468033,"Some background info: Mr Love Queen’s Choice is a successful otome mobile gacha game developed by Papergames, a company known for making for-girls mobile games. Mr Love has 5 dateable characters (all cute guys lmao) and each one has their own dedicated fan group.",0,,https://pbs.twimg.com/media/EfD3giFUMAANzI9.jpg
1291469396607733760,Lithium in drinking water 🚰,0,,https://pbs.twimg.com/media/Eew4YLQXYAod9Hs.jpg
1293169919794831361,"Together with other policies practiced by ""Israel"", the threat of destruction of homes and sources of livelihood contributes to the generation of a coercive environment pressuring people to leave their areas of residence. ",0,,https://pbs.twimg.com/media/EfJDLfKX0AEBtJV.jpg
1293320171164237826,This is unbelievable. Even the Republic of South Africa sanctions more Arabs than Israelites.  @ConCourtSA loves Apartheid Israel so much it permits its own so-called sovereign  bankers to trade the tools of war — used and tested on Arabs.,0,,https://pbs.twimg.com/media/EfLL1yUWAAE2o_B.jpg
1292394808993091584,"stood in the way of Zionist-Anglo-American empire in the Southern African Development Community (SADC). Indeed, the party is the leader of ""Axis of Resistance"", the role @MYANC couldn't fulfill, be it militarily or ideological. ",1,3,https://pbs.twimg.com/media/Ee-CNfeXoAAMXSn.jpg
1275961938829209600,i censor you for #zog,1,3,https://pbs.twimg.com/media/EbUgnc7VAAIYsj0.png
1288655158524534785,"Albania aligned with Austria against their mutual Serb enemies in WWI, resulting in an Austro-Italo-Serb occupation. The postwar situation was chaotic, but King Zog was able to unify 🇦🇱 in 1924 with support of Yugoslav government, his own northern territory &amp; Gheg allies.",0,,https://pbs.twimg.com/media/EeI5CMgU8AA7-bq.jpg
1292999618251370497,.No history of “fakestinians.”  Jewish history...,0,,https://pbs.twimg.com/media/EfGoMxIX0AMzb00.jpg
1292260085557854208,Get this Zionist propaganda out of my TL,1,3,https://pbs.twimg.com/media/Ee8HsnnXYAE1OTA.jpg
1278028280059346946,"Fantasy fucking Island, planet Zog!",0,,https://pbs.twimg.com/media/Ebx38b3XYAEkPIf.jpg
1276522436213817345,here's the TLDR of Strike and Mike: &gt;Communism is good &gt;Striker needs more welfare because he can't get a real job &gt;Coronavirus is going to kill us all &gt;White liberals r da REEEEL white nationalists &gt;ZOG must inject white babies with Jewish vaccines,1,0,https://pbs.twimg.com/media/EbceUa7XsAAwBgF.jpg
1291690760463679488,Properties including “The Gruffalo” and “Zog” will be available for streaming on UKids by UYoung. Learn more --&gt;,0,,https://pbs.twimg.com/media/Ee0B5sLXgAEyMVX.png
1292284409564016640,"I would prefer to say, ""because they are not #zionist"" - but mostly it's because they are the real owners of Palestine, the real indigenous people, &amp; the #SquatterColonialists know that. I've been trying to understand the question ""How can israelis, IOF et al, sleep at night""? ",1,3,https://pbs.twimg.com/media/Ee8d0VTXYAE1z3S.jpg
1292533136254009344,Rabbi Schneerson said observance of noahide Law would constitute a “complete victory” over the nations,0,,https://pbs.twimg.com/media/EfAACBxWsAgcXCG.jpg
1293216940622852096,"Righteous Among the Nations Joop Westerweel was executed in the Vught concentration camp #OTD 11 August 1944  Realizing that hiding was not sufficient to save the Jews, the group that he led began devising ways to help them escape from Dutch territory",0,,https://pbs.twimg.com/media/EfJt9DuWkAEdIvF.jpg
1278358191089291264,Old two-eyes himself...Scorer of one of the best own goals I have ever seen....,0,,https://pbs.twimg.com/media/Eb2jxSDXkAAdOF0.png
1283090198209785856,"#JewishPrivilege means constantly having 2 deny that u ""control"" the media, banks, the #ZOG, killed Christ, poisoned the well, stole ""Palestine"" from innocent peace loving Arabs, worship Satan, defend urself against the grunts of Mel Gibson morons, ran the slave trade + are ugly. ",0,,https://pbs.twimg.com/media/Ec5zOFLUYAI7AiA.jpg
1285667424021381123,They've been putting up a lot of new CCTV cameras in the #Edinburgh area recently..and laying Virgin/City Fibre..and changing the lampposts.. But that's none of our business...🐸  #5G #PoliceStateUK #plandemic,0,,https://pbs.twimg.com/media/Edebs4JXkAMDBWA.jpg
1293034412704182273,Lets pretend there is a left and a right and get everyone all worked up right Rick? Lets not talk about the wicked Zionists who totally control Trump and all of DC and looks like maybe Trunews too since you don't talk about that truth!!!,1,0,https://pbs.twimg.com/media/EfHHqFwXoAAhcSr.png
1279099951969005569,"Gotta vote him out first. But you're right, sis!",0,,https://pbs.twimg.com/media/EcBGWLnVAAEX33s.jpg
1293065387555172352,Will Supreme Court block yeshiva students from coming to Israel?,0,,https://pbs.twimg.com/media/EfHkHhLUMAIrbhX.jpg
1276084211389214720,It’s Dragon School day today! Look at us completing our flying lesson... #zog #dragonschool #pineconesuhps,0,,https://pbs.twimg.com/media/EbWPvOqXkAAQjr8.jpg
1293280199853907969,"Jews, who are the actual ""Palestinians,"" in the first place, aren't stealing anything by remaining there, microNazi.  Speaking of land theft, microNazi... ",0,,https://pbs.twimg.com/media/EfKne_DXsAUemVq.jpg
1293253898476675072,,0,,https://pbs.twimg.com/media/EfKPkKcWsAAu-5W.jpg
1292831183605309440,"The irony that this is coming from someone supporting actual #terrorists. Then again, what should I expect from a Zionist.",1,3,https://pbs.twimg.com/media/EfEPHBfWoAIPXMj.jpg
1293358834069757953,MINGHAO JEW???,0,,https://pbs.twimg.com/media/EfLvAKyXgAAHtiQ.jpg
1293106098744909825,"bullying is ok for him and only him, he’s a pro-life, homophobic, islamophobic, zionist. kol should’ve stayed d word",1,3,https://pbs.twimg.com/media/EfIJJAmU4AAIFyD.jpg
1292163706697244672,"No surprise to see that the numpties at SAS - another Corbyn fan club - have no problem with sessions on antisemitism not involving any, you know, proud, Zionist Jews.   Did they read the CLP report? Can they read? We know they can’t think.",1,3,https://pbs.twimg.com/media/Ee6wCrfX0AERa8c.jpg
1293285589106806786,You would have not wanted Jews to flee here in 1938 I presume ?,1,3,https://pbs.twimg.com/media/EfKsYu5WkAYxdAj.jpg
1277238316480552960,Wow!!!  YouTube allows this 😳,0,,https://pbs.twimg.com/media/EbmpeF9XgAAk0jE.jpg
1277754764378492929,(The idea of ZOG is adopted/adapted from a turn of the 20th century (Russian) Czarist “forgery which has proven to be the most resilient piece of disinformation in history” that was disseminated worldwide and translated into multiple languages by the KGB),0,,https://pbs.twimg.com/media/Ebt_Lo-WsAA298u.jpg
1283795737931907078,Some pictures from Zog bubble sports day!  They were all super stars! 👍😀🌈Mr Woodrow said that they were kangaroos!!! we got the highest score in the long jump! 👍😀🌈Last day tomorrow still school uniform! 👍😀🌈,0,,https://pbs.twimg.com/media/EdD1ahiXYAEVuFJ.jpg
1292297470366687232,#JUDAISM ON #YOGA: Exercise or Idolatry? – A new video from #Rabbi Michael Skobac –,0,,https://pbs.twimg.com/media/Ee8pfGLXkAE6LFK.jpg
1293286127693070336,,0,,https://pbs.twimg.com/media/EfKs39sXsAExzBZ.jpg
1293243952045477890,Why encourage the Tories. We had the controls when Jews were deported back to Europe in the 1930s. There is no smart way to oppose fascism.  There is only relentless opposition.,1,3,https://pbs.twimg.com/media/EfKGhFoX0AckIKv.jpg
1292578545898860545,Definitions vary. I doubt they would’ve been anti Zionist if you didn’t choose to locate your ethno state and carry out your ethnic cleansing in their homeland. Can you read?,0,,https://pbs.twimg.com/media/EfApVZPWAAAMK-H.jpg
1287385849672478721,Is this really Tedros Adhanom 🤔,0,,https://pbs.twimg.com/media/Ed21hO-WkAEKlKW.jpg
1293295669285920768,History of Jews and badges in one picture  Im surprised a loyal Catholic is such a Nazi sympathizer:,1,2,https://pbs.twimg.com/media/EfK1jfHXgAAUslP.jpg
1292222155883712512,"I have 5%. Kings and queens, you have the honor to bonk the zionists when im gone and do tag me. Gn yall💕",1,3,https://pbs.twimg.com/media/Ee7lMyPX0AAhUGq.jpg
1293195437843742724,We used to dance for spiritual enlightenment. Now the media and the fake Jews and the Europeans changed are dancing to a sexual nature. Dance for for the past dance for the present dance for or future. Power is only give to those who know power. Sound the drums of revelation .,0,,https://pbs.twimg.com/media/EfJaWgYUMAIDIZS.jpg
1288825312915132417,Planet Zog of course,0,,https://pbs.twimg.com/media/EeLTxx5XgAAbWlj.jpg
1293339025848143873,Q ) they must be afraid of something?   A ) nothing frightens Jew more than the victim who rise above abuse n become successful; seeing people they thought they destroyed to recover n succeed it's their worst nightmare. Victim must be destroyed n entire family wiped out.,0,,https://pbs.twimg.com/media/EfLc_Q0UMAAeE6p.jpg
1279127028286005251,We have also been busy doing some Maths activities based on Zog by Julia Donaldson.,0,,https://pbs.twimg.com/media/EcBfPgVWoAEpVYl.jpg
1293230811957719040,Katju is a kind of Liberal Hindi who’d preach Jewish reform to Jews under the Nazi persecution instead of wearing a yellow star to identify himself with the beleaguered minority. #katjurevelations,0,,https://pbs.twimg.com/media/EfJ6kaNVAAAoTiU.jpg
1292869141855010816,"Rabbi Adin Steinsaltz, Who Made the Talmud More Accessible #obitpix #rabbiadinsteinsaltz #jewish #scholar #writer  #steinsaltzcenter #artistsoninstagram #penandink #drawing #watercolorpainting #illustration #portrait",0,,https://pbs.twimg.com/media/EfExnN1UEAUB1UM.jpg
1278228657929097217,,0,,https://pbs.twimg.com/media/Eb0uL1NWkAECbiP.jpg
1293256169344073730,"Thank you 😭😭😭 you should also look into these!!! This one has been the most durable during growth, it’s called a wandering Jew or a tradescantia zebrina! V hardy and beautiful plant",1,3,https://pbs.twimg.com/media/EfKRoS-XkAI_kso.jpg
1292719763735576576,📰Today's headlines | Zionist regime’s tanks attack Gaza sites  🔗,1,0,https://pbs.twimg.com/media/EfCpuKQWAAA_w8l.jpg
1292529898511372290,being a zionist and having a face like that must be a struggle,1,3,https://pbs.twimg.com/media/Ee_9F5XWAAEz_B-.jpg
1292536512131796996,graduate and former SJP activist Raya Ali had a big problem with her alma mater: “F**k brooklyn college fricking Zionist a** school”,0,,https://pbs.twimg.com/media/EfADG62XkAAM6by.jpg
1277619919165763584,ZOG fears this,0,,https://pbs.twimg.com/media/EbsEGz7WAAIHGCb.jpg
1292522870984368128,"1. Yes indeed the Zionist Entity sees non Jewish inhabitants of Israel as 3rd class citizens. it even sees many Jewish inhabitants if Israel as 2nd class citizens, to the extent of performing Eugenics upon them and spraying them with DDT poison. My point is countering",1,3,https://pbs.twimg.com/media/Ee_2cLLXgAYuMjV.jpg
1280587926833938435,The only thing revealing of this article to me is that #Cardano is a centralized network and they are “planning on transitioning” to a decentralized one...,0,,https://pbs.twimg.com/media/EcWP43MXgAAdXfK.jpg
